<?xml version="1.0" encoding="UTF-8"?>
<migrationMessage xmlns:xsi="http://www.w3.org/2001/XMLSchema-instance" xmlns="urn:inera:certificates:mc2wc:1"
                  xsi:schemaLocation="urn:inera:certificates:mc2wc:1 mc2wc-schema.xsd ">
  <certificate>
    <certificateId>certificateId</certificateId>
    <certificateType>certificateType</certificateType>
    <careUnitId>careUnitId</careUnitId>
    <patient>
      <personId>personId</personId>
      <fullName>fullName</fullName>
    </patient>
    <sent>2001-12-31T12:00:00</sent>
    <created>2001-12-31T12:00:00</created>
    <origin>origin</origin>
    <migratedFrom>migratedFrom</migratedFrom>
    <contents>MA==</contents>
  </certificate>
  <questions>
    <certificateId>certificateId</certificateId>
    <certificateType>certificateType</certificateType>
    <certificateSigned>2001-12-31T12:00:00</certificateSigned>
    <externalReference>externalReference</externalReference>
    <patient>
      <personId>personId</personId>
      <fullName>fullName</fullName>
    </patient>
    <carePerson>
      <personId>personId</personId>
      <fullName>fullName</fullName>
      <prescriptionCode>prescriptionCode</prescriptionCode>
      <careUnit>
        <workplaceCode>workplaceCode</workplaceCode>
        <id>id</id>
        <name>name</name>
        <phone>phone</phone>
        <email>email</email>
        <postalAddress>postalAddress</postalAddress>
        <postalNumber>postalNumber</postalNumber>
        <postalCity>postalCity</postalCity>
        <careGiver>
          <id>id</id>
          <name>name</name>
        </careGiver>
      </careUnit>
    </carePerson>
    <subject>WORK_PROLONGING</subject>
    <caption>caption</caption>
    <sent>2001-12-31T12:00:00</sent>
    <signed>2001-12-31T12:00:00</signed>
    <originator>FK</originator>
    <status>CREATED</status>
    <questionText>questionText</questionText>
    <questionLastAnswerDate>2001-01-01</questionLastAnswerDate>
    <answer>
      <text>text</text>
      <signed>2001-12-31T12:00:00</signed>
      <sent>2001-12-31T12:00:00</sent>
      <status>CREATED</status>
    </answer>
    <supplement>
      <field>field</field>
      <text>text</text>
    </supplement>
  </questions>
</migrationMessage>
